headline,content,response,star
Gem of a Place,"We were downtown with friends and family looking for a place to get a nice bite to eat after visiting the Louisville Slugger Museum and Factory; when we stumbled upon this gem of a place. 

The restaurant had a great feel to it. We arrived...More","Hi!

Glad to hear you enjoyed everything. Thanks for coming and for taking the time to review and recommend us! Hope we can see you again soon!

Thanks,

Nathan",5
Great Burgers!,"Popped in for lunch with my husband on our honeymoon! Service was great, very friendly waiters....burgers were lovely...rated 4 stars as got a little sickly after a while! Otherwise, great place!!More","Hi Katie,

Thanks for coming and for taking the time to give us a review and recommendation! Happy to hear you enjoyed everything. Sorry if it was something we did that made you get sick. I asked our Executive Chef to double check our product...More",4.5
Super good,"My Japanese coworkers wanted a more American place to eat, I searched around and found this place highly rated. It didn't disappoint. It was very good, after a long trip of OK places to eat. Definitely worth it to try any of their mussels.","Hi Kenneth,

I'm glad you found us! Thanks for taking the time to give us a review and recommendation. Happy to hear that you and your coworkers enjoyed everything so much. Thanks for coming, and hope we can see you again sometime!

Thanks,

Nathan",4.5
5 O'Clock Somewhere!,"Was visiting and had to try, since my wife has become a mussel fan. Wasn't disappointed. The food was great!  We had mussels and a burger, of course.  Awesome fries, too.  As I'm scanning the place, I see a clock over the cool bar.  I...More","Hi Lou,

Thanks for coming and for taking the time to review and recommend us! Glad you enjoyed everything, and happy to see you noticed the clock. Hope we can see you again soon!

Thanks,

Nathan",4.5
Good Burger.,"This place was crowded but we were seated after 10 minutes. Had the burger with chorizo, chorizo somewhat over-powered everything else, but still tasted good. We would return.","Hi Tony,

Thanks for coming and for taking the time to review and recommend us! Thanks for the feedback about the burger, I show the Executive Chef all of our reviews. Hope we can see you again soon!

Thanks,

Nathan",5
For a Great Burger,"This restaurant has great atmosphere and a fun menu.  The mussels were good but I'm not a mussel fan. My kids loved them. We really liked the Dates in a Blanket (There's only 3 so plan to split them up), The C.E.O., and The Argentinian....More","Hi!

Thanks for coming and for taking the time to give us a review and recommendation. Glad you enjoyed everything, and hope we can see you again soon!

Thanks,

Nathna",4.5
Mussels are a must!,I would have given this review 5 stars buy the southern burger I ordered was ok....nothing to write home about. However the mussels were incredible. If I had only ordered that...it would have been 5 stars hands down.More,"Hi!

Thanks for coming and for taking the time to review and recommend us. Glad to hear that you liked the mussels so much! Anything in particular you could share about the Burger? It's one of our most popular items, just want to make sure...More",3.5
Unique burgers.,My wife and I ate lunch here this morning.  This restaurant is located in downtown Louisville is an old but well maintained building.  Great ambience and great food.  We were here for lunch so we saw many local workers on their lunch break.  We'll return.,"Hi!

Thanks for coming and for taking the time to give us a review and recommendation! I'm happy to hear that you enjoyed everything. There's a lot more to try, so I hope you can come back soon!

Thanks,

Nathan",4.5
40th birthday trip,Saw this place on Burger's Brew & Que. This restaurant is top notch. The food was excellent and the Cinnabomb was DA BOMB! Drinks were priced right and delicious. I mean who doesn't want a piece of bacon in their Bourbon drink. 100% will return...More,"Hi Harley,

That's awesome - I'm so happy you got such a nice experience after deciding to try us out on your birthday trip. Thanks for coming and for taking the time to review and recommend us. I hope we can see you again soon!...More",4
Just a weekend get-a-way,"This restaurant was fabulous all the way around. Terrific food, great service, great ambience and very enjoyable music playing. My husband and I shared the dates in a blanket and they were delicious. I had the BBB burger (I got it without the bun) with...More","Hi Selena,

Thanks for coming and for taking the time to give us a review and recommendation! It's awesome to hear about how much you enjoyed your experience. The Dates in a Blanket are one of our most popular appetizers so it's great to hear...More",4
First trip to the mussel bar,The building is gorgeous.  There was a wedding party there and some prom goers.  The mussels were average.  We had three different kinds and we only liked one of them.  Not sure I would go again.More,"Hi!

Thanks for coming and taking the time to review and give us some feedback. Sorry you didn't get to enjoy all of your entrees. Do you remember which mussels you didn't like? I hope you'll consider coming again. We can make sure they're being...More",5
Stopped for afternoon drinks ,"Stoped for afternoon drinks with a couple friends when in the area. Was worth the stop. Had a good variety of beers and liquor. Was a nice,  relaxed atmosphere. Didn't try the food, but would go back and try if in the area again.","Hi John,

Thanks for reviewing and recommending us! Hope we'll get to see you again soon and be able to serve you some food!

Thanks,

Nathan",4.5
YUM!!! Glad We Went,"Nice, friendly atmosphere with delicious food and drinks. Be prepared for a wait on the weekends but it was worth it. We tried the dates in a blanket which was surprisingly delicious (dates wrapped in bacon - the sauce was fabulous). They offer mussels in...More","Hi!

Thanks for coming for taking the time to review and recommend us! It's great to hear your remarks about the food and service - I'll be sure to tell Brendan how much you appreciated his service and hospitality. Hope we can see you again...More",4.5
Delicious! Delicious! Delicious!,"I am in Louisville for my travel blog and my hotel is across the street from the Mussel & Burger Bar. The valet guy told me that the burgers (he specifically recommended the lamb burger) were too good so I walked over for dinner.

The...More","Hi Angie,

Thanks for coming and for taking the time to review and recommend us! It's great to hear that you enjoyed everything during your dining experience. The Dates in a Blanket and Short Rib Nachos are two of our most popular appetizers, so it's...More",4.5
Delicious Dining Experience,"Asked for several recommendations for where to eat with two kids and everyone mentioned fast food, but one guy told us that the burgers were the best to be had downtown. Family of four, arrived before the dining room opened and we were greeted and...More","Hi April,

That's awesome! I'll be sure to show Ms. Casey your positive review about her! Glad to hear we lived up to the word around town. Thanks for coming, and we hope we can see you again sometime!

Nathan",5
Great food..,"On a business trip visited with a group of 9, sat quickly, ordered drinks right away. I ordered the bacon burger with a shock top came with fries. Cooked to my request beer was cold service was fast and courteous. Would definitely visit again highly...More","Hi Mark,

Glad to hear that we could take care of your party, and that you had such a nice experience! Thanks for coming, and for taking the time to review and recommend us so highly. That's awesome. Hope we can see you again soon!...More",4.5
Southern Bell,"Stopped in this place looking for a great burger for lunch and was not disappointed. They had a great selection and I wanted to try 3 of them but settled on the Southern Bell. Fried green tomatoes, pimiento cheese and remoulade sauce, not something you...More","Hi Jackie,

Thanks for coming and for taking the time to review and recommend us! I'm glad you enjoyed your Southern Belle Burger while visiting down here. It's great to hear a traveller's positive review. Hope we can see you again sometime!

Nathan",3.5
Best burgers in Kentucky!,"We dined on a Sunday night. This place is so popular it was packed. I had the vegetarian burger lathered in picked cabbage and served with crisp sweet potato fries. Our friend a the ""Local"" and said it was perfect. His was served with fingerling...More","Hi Jayhawk,

That's awesome! It's great to hear that you enjoyed everything! Thanks for coming, and we hope to see you again soon!

Nathan",4.5
The Burger is One of the Best,"The menu features numerous burger options and each that I have tried has been superb!  Great décor, upscale atmosphere and wine list too!","Hi Cindy,

Thanks for coming, I'm glad to hear you've enjoyed everything during your dining experiences with us! Thanks for taking the time to review and recommend us. Hope we see you again soon!

Nathan",4
A good hamburger but slow service,If you are looking for a good hamburger at downtown prices this a good choice.  Just allow plenty of time as the service has been rather slow during my many visits.  The background music is usually too loud but they will turn it down if...More,"Hi Estes,

Thanks for coming and for taking the time to review and recommend us. I'm glad to hear that you have enjoyed the food. I'm sorry about the slow service you had during your experiences. That's disappointing. I'll show your review to our staff...More",4
Very nice food and atmosphere at this place.,"The food was very good with nice flavour so that part was a winner, but the portions are tiny, which means that it's leaning more towards fancy and you will be either broke or hungry when you leave this place, but I did enjoy it....More",NA,5
A fun Saturday,We had a great dinner and the burgers were fantastic.  It was nice to try one of their signature drinks before getting it.  The service was very attentive and really knew the menu.  We will be back to eat next time we are in town.,"Hi Kathy,

Thanks for coming, glad to hear you liked everything. I appreciate that you took the time to review and recommend us! Happy to hear the service was good too. Hope we see you again soon!

Thanks,

Nathan",4.5
Cubano Burger!,This was a departure stop on my way to the airport. The waiter was very friendly and knowledgeable of the menu. I chose the Cubano Burger. My burger was huge and the sweet potato fries were accompanied by a smoky pineapple sauce that was absolutely...More,"Hi Delsia,

Thanks for coming Delsia! I'm glad you enjoyed the food and service, and thanks for reviewing and recommending us! I love the smoked pineapple sauce too!
 
Hope we can see you again soon! 

Thanks,

Nathan",4.5
Mussels and Burgers Both Great,"Family met here for dinner. Had to wait 45 minutes for tables. Mussels were outstanding and recommend the white wine sauce preparation. Too many variations on burgers. Traditional burger was best, but CEO also tasty. For Gras was really good.More","Hi James,

I'm glad you enjoyed everything and decided that it was worth the wait! Sounds like you got to try mussels and a burger, that's awesome! Thanks for coming and for taking the time to review and recommend us! Hope we get to see...More",4.5
Birthday dinner,Great evening celebrating my birthday with family. The burgers and mussels were delicious. Service was outstanding.More,"Hi Judy!

Happy Birthday! It's awesome you chose to celebrate at our restaurant, and I'm so happy you had a good experience! That's great! Thanks for coming and for taking the time to write a review and for recommending us! Hope we get to see...More",5
Great Food in Louisville,"Excellent lunch-we had mussels as an appetizer.  The sauce was delicious.  The burgers were huge, juicy, and perfect.  The decor is beautiful.  The location is perfect for anybody visiting the attractions on museum row.","Hi!

Happy to hear that you enjoyed everything when you came! Thanks for taking the time to review and recommend us too! Hope we get to see you again soon!

Thanks,

Nathan",4.5
Best burger I have ever had!,"Had the best burger I have ever had. It is a gourmet burger. We had terry as a waiter and he was awesome! On e burger came out over cooked but they had a new one out within minutes, and then gave it to us...More","Hi Jared,

That's awesome sir! I'm glad you guys enjoyed everything so much, and appreciate the understanding with the overcooked Chorizo burger we sent out! You guys were a pleasure to serve, and we hope you'll come back again! I'll be showing this review to...More",3.5
This place does it right!,Great job here. Very good bourbon selection. The mussels make a great appetizer. The burgers were great. Service was excellent as well.,"Hi!

Thanks for coming and for taking the time to review and recommend us! I'm happy to hear that you enjoyed everything so much! We will be getting the bourbon selection printed on our menus soon, so it'll make shopping even more fun!

Thanks,

Nathan",4.5
Everything was great,"We had reservations elsewhere at a fancier place across town but cancelled them after seeing this place a block from our hotel and after reading its great reviews. We made the right choice. We had mussels with blue cheese beer pancetta sauce, served with yummy...More","Hey Alison,

That's an awesome review, I love reading it and am going to show it to our staff today. I love your remarks about the service and food, and can't thank you enough for coming and for taking the time to write a review...More",4
"Cannot recommend, especially when price is considered","The interior space is nice, and staff friendly - would probably be fine for just beverages. Started with mussel appetizer. Mussels were dinky but fresh and no grit. Ordered: ""Moules Basquaise - Chorizo, olive oil, lobster sofrito broth, piquillo peppers, Piment d’Espelette, onions."" Tasted like...More","Hi Steve,

I'm sorry about the experience you had Steve. We want everyone to have an awesome time here. We work and train for it. But everyone is different and enjoys different things. The Argentinian Burger is one of our most popular items. It was...More",4
Here's the Beef!,"Stopped with the family for dinner on a recent business trip to Louisville.   All of us ordered different burgers.  Absolutely worth it!  I had the Spanish Blue, others had: Bacon Breakfast Burger (complete with a sunny-side up egg and a maple syrup aioli), Southern Belle...More","Hi Phil,

I'm so happy to hear about your experience. I'm glad you enjoyed everything, and it's great to know that even after a mistake you left satisfied. Thank you for coming, and for taking the time to write a review and recommend us. Hope...More",5
Amazing ,Took my daughter and grandsons here for lunch during a little weekend getaway and it was amazing. We loved the atmosphere (even with a 3 and a 1 year old). The service was great and the food was even better. I tend to ask our...More,"Hi Donna,

That's great! Happy to hear how much you enjoyed everything. Thanks for coming and for taking the time to review and recommend us. Come back and see us again soon!

Thanks,

Nathan",4.5
Gourmet Burgets,Great variety of gourmet burgers for all tastes. The building is cool and well decorated. I ate the Argentinian burget and it was delicious. Prices on the high side but sizes are big enough for big appetites. I recommend,"Hi Marcelo,

Happy to hear you liked the food and building! The Argentinian burger is super popular so it's good to hear some good feedback about it. Thanks for taking the time to review and recommend us! Hope we see you again soon.

Thanks,

Nathan",4.5
Great place pre-show meal,Went pre-show with a large group. Burgers are the best! One vegetarian in our group said the vegetarian burger was also great. Kids all happy with their meals. Easy walk to Kentucky center.,"Hi Meredith,

Happy to hear you enjoyed everything before your show. Thanks, for taking the time to review and recommend us. Glad your vegetarian friend like our Veggie Burger, I think it's great too! Hope we see you again soon!

Thanks,

Nathan",4.5
Quick Delicious Lunch! An Amazing Surprise.,"This place was recommended to us by the gal in the Louisville Slugger gift shop. 
SOOOO glad we went. It was amazing. We were seated right away. The restaurant was super clean and the service was very fast. 

TIP: highly recommend The Short Rib Nachos!!!","Thanks Chris! 

Those nachos are our most popular appetizer! Glad you liked everything, and hope we see you again soon!

Thanks,

Nathan",5
Quick Lunch! Delicious!!,This place is excellent. Very good food and great service!! Cannot day enough good things. Burger was fresh and cooked just right. Truffle fries were perfect. Just an all around perfect experience!! Will be back!!,"Hi!

Thank you for coming and for taking the time to review and recommend us! Really excited to hear that you enjoyed everything so much, that's awesome! Hope we see you again soon!

Thanks,

Nathan",4.5
BBB+: Building Better Burgers +!,"We were invited to Mussel and Burger Bar by a 'native' of Louisville, and were thrilled for the chance to experience it. The menu is wonderful with great ingenuity and creativeness in its preparations. The truffle fries were steak fries on steroids, like a russet...More","Hey,

Thanks for coming and for taking the time to review and recommend us! Glad we got the opportunity to serve you while you were in town. Sounds like you liked everything, so that's awesome.

Thanks,

Nathan",3.5
Dinner,"We stopped in for dinner after visiting the Science Center.  Service was great, our server (Eric) was very attentive.  We had the Greek Mussels,  Yum. My husband and I shared the local burger which was cooked perfectly.  We will recommend this highly. Thank youMore","Hi Jim,

Thank you for coming and for taking the time to review and recommend us! That's awesome, I'm glad you enjoyed everything so much. Those Greek Mussels are super delicious, happy to hear you liked them. I'll be sure to tell Eric how much...More",4.5
Great Saturday Lunch!,"We visited here on a Saturday for lunch with out of town friends. Had a fabulous lunch and drinks. We had the BBB, the bleu cheese burger, and the Adirondack. Great meals. Great Service.","Hey!

Thanks for coming and for showing us to your friends! Happy to hear that everyone enjoyed everything. Thanks for coming!

Thanks,
Nathan",4
Wonderful ,Me and the wife stopped in for a few drinks and dinner before basketball game. Absolutely awesome. Great beer selection and the burgers are great. You have to get the stuffed dates. It's a must,"Hi Michael,

Thank you sir for stopping by, awesome to hear that you had a great time! Thanks for reviewing us, and recommending the Dates in a blanket - it's one of our most popular appetizers. Hope we'll see you again soon!

Nathan",4
"Simple, but beautiful","There is not one thing to dislike about this place, unless you are not human. The food is amazing...doesn't matter if you are just there for an appetizer or for the meal. The selection of adult beverages is extensive and the wait staff, bar staff...More","Hi Candice,

Thank you so much for the kind review about our place and staff. Really makes me happy to hear that last part about the staff being so wonderful. Thanks for taking the time to review and recommend us! Hope we see you again...More",5
Dinner on a Friday night ,"Service was excellent. Waiter was knowledgeable and patient with questions. I had seafood burger was very tasty, it comes on a pretzel roll which I found to be way too much bread. The pomme fritte are awesome! Not a fan of their margarita, was bitter....More","Hi Nancy,

Thanks for coming and for taking the time to review and recommend us! Glad you liked the Seafood burger, I love that one. It's like a giant crab cake burger! Sorry you didn't like the margarita, hopefully we were able to get you...More",4.5
Worth every penny!,"So the atmosphere was great, service was great, food was amazing! A bit pricey but it's worth every penny! I got the Spanish bleu and a bourbon brew, followed by an flourless tart with coffee ice cream and candied almonds for dessert to go! All...More","Hey Nikki,

That's great to hear! Happy you enjoyed everything so much, and thanks for taking the time to review and recommend us! Hope we can see you again soon!

Thanks,
Nathan",4.5
Mussels and burgers were great,"We came here for lunch after touring the Louisville Slugger Factory, and we were greeted warmly by the front desk and seated immediately. Out waiter was attentive and repeatedly went out of his way to take care of my allergies, which can be difficult.

I...More","Hey Paul,

Happy to hear we took care of you, and that you didn't wind up in the hospital! I'll be sure to tell Dylan about the review, and your gratitude. Thanks for coming and for taking the time to review and recommend us! 

Hope...More",4.5
Outstanding ,"In Louisville KY for the holiday we walked the short distance from our hotel. In spite of the chilly weather and rain outside we we quickly greeted by our server, Kate. 

We started dinner with a Markers Mark Old Fashion which was expertly prepared. Asking...More","That's awesome! I'll be showing this review to Kate! We're happy that you enjoyed everything, and hope we see you again soon!

Thanks,
Nathan",5
Hidden Gem,This is a Louisville secret. We walked in and were greeted with a great associate.  Ask for Kate and Joe.  Kate is an asset to the establishment.  She listens to what you like and offers great suggestions some you didn't know you would try.  With...More,"Hi Circuitboy75!

Thank you so much for taking the time you review and recommend us! It's great to hear about such an awesome experience. All of the dishes you had are very popular, and favorites among the staff, so it's nice to hear that you...More",4.5
Good Waitress and Burger,We started with the short rib nachos  which were outstanding. Our waitress kept coming back to see if we were ok and kept refills coming. The glasses were in Ball glass jars which gave a rustic southern feel. I had the bacon burger with blue...More,"Hey Will,

Thanks for coming and for taking the time to review and recommend us! Sorry about the overcooked burger, just know that if it ever happens again we are always ready to get you another burger cooked correctly! Glad to hear you enjoyed the...More",3.5
Excellent food ,This was my 1st time at the downtown location and the standard of quality is on par with thier East End location.  6 if us went for dinner before a show at the KY Center. We started with the Mac&Cheese to share and it was...More,"Hi Tanya,

Thank you for coming to try the downtown location and for supporting our little company!
I'm happy to hear that you enjoyed everything, and appreciate you taking the time to share your review and recommendations! Hope you consider us next time you take...More",4.5
great find,We happened upon this place and we were very happy we did. Good whiskey selection and awesome burgers. One of the best burgers I've eaten anywhere. Creative burger selections and cooked perfectly. Staff very friendly and they want you to be pleased.,"Hey Andrew,

Glad you found us and came! Happy to hear that you had such a great experience, and we hope to see you again soon!

Thanks,
Nathan",4
Mussel & Burger bar,"This place is located directly across the street from the 21C hotel where we stayed. We went there one night for a drink and food. Everything we tried was very good, and reasonably priced.","Hi Charles,

Thank you for visiting and for taking the time to review and recommend us. Hope we will see you again sometime!

Thanks,
Nathan",4
Best burger,"We had the bbq rib nachos, and they were fantastic. Our burgers were perfect and very large, too! Great atmosphere.","Hi Lisa,


Thanks for coming and for recommending us. Glad to hear you liked the Short Rib Nachos, those are our most popular appetizer! Hope we see you again soon!

Thanks,
Nathan",5
Out of towners - Went back twice!,"We were only in Louisville for 5 nights and went back to this place a second time because the mussels were so good.  The very unusual combination was at first unappealing to me, but my husband loves mussels, so we went.  He and our friend...More","Hi 48Buddy,

That's awesome - Awesome that you came twice during your visit to Louisville. I'm glad to hear that you enjoyed everything so much. Thank you for coming and for taking your time to make a review and recommend us!

Nathan",4.5
Mussels are Excellent!,"We really enjoyed our visit to Mussel & Burger Bar Downtown.  We tried the Meunière and the Mexican Pozole Mussels.  Both were excellent!  I could have drank the sauce on the Meunière, but I refrained. The Mexican Pozole were a bit spicy, but I love...More","Thanks Heather!

Glad you came, and thanks for taking the time to review and recommend us. The mussels are awesome and we have 6 flavors for you to work your way through!

Thanks,
Nathan",4.5
Swing by,"Great little atmosphere to grab a drink.  Quite pricey on the food for what you get.  Opted to grab an appetizer and bolt to another venue due to the pricing.  Not very many people there for a Saturday night, but can see why.More","Hi Amy Zach,

Sorry we couldn't give you a better dinner experience. I know last night we were slower than our normal Saturday dinners. I think it was because of the Halloween weekend.  The prices are higher than most other Burger restaurants mostly because of...More",4.5
