headline,content,response,star
Delicious Food and Engaging Staff,"Recommended by locals (staff at Michter's).  Burger, seafood burger, elotes, homemade ice cream - all delicious!  In addition to providing excellent service, the staff was very friendly and offered plenty of suggestions for things to do in Louisville.",NA,5
Excellent!!,Mussels Meunière - excellent. Blue cheese beer pancetta mussels - Excellent. Bacon Breakfast Burger - excellent. C.E.O. Burger was very good. Local Burger was excellent. Southern Bell burger was excellent. Fingerling potatoes & house fries were excellent. Seafood sliders were excellent. Ground beef Taquitos were...More,NA,4.5
Love this place.,Who would have thought that a menu centered on mussels and burgers would work? It works amazingly! Eat here. You’re welcome.,NA,3.5
Better Than Before,"I had eaten here once before but I was not really crazy about what I ordered.

I was in town for work again and I thought I would try it again but I decided to order a different hamburger.

I had one with bacon, egg...More",NA,4.5
At last! Mussels as good as in the famous Dutch village of Philippine!,"At last! After 11 months traveling thru the US, visiting 20+ states and 50+ restaurants: the place where you can eat mussels as tasty as in my home region of the famous Dutch mussels village called Philippine! You need to get there and taste them...More",NA,4
Wonderful Dinner in Louisville,"Had a wonderful dinner at Mussel and Burger Bar Downtown Louisville.  We had Mac and cheese some of the best ever), mussels greek style (very good, and lots of flavors.  Next time however I’d probably get more routine version as I prefer the tase of...More",NA,4
Burgers for lunch,"Overall excellent experience. It was hard to choose which burger, they all sounded good. Our awesome waiter, Zachary, suggested the CEO burger for it's oven roasted tomatoes which were heavenly. It came with steak fries that was essentially a giant potato quartered and roasted. My...More",NA,5
Good Choice for Lunch ,We were in town visiting and stopped into M&B for lunch. We had a two year old with us and weren’t sure they accommodated kids. The host couldn’t have been more gracious and seated us even though they were very busy. We ordered something for...More,NA,4.5
Absolutely Wonderful,I’ve never tasted a burger so fresh and delicious.  The wedge salad was quite good as well!  We can’t wait to go back and try the truffle fries,NA,4.5
Something For All,"This restaurant is casual, and has delicious food to please meat eaters as well as vegetarians and vegans. Gluten free options and decent cocktails,too! Lots of TVs for those who want to catch a game. I loved their veggie burger served with no bun by...More",NA,4.5
So good!,Stopped by the Mussel & Burger Bar for lunch after a visit to the 21C Hotel Museum.  Decided to just have appetizers this trip.   Had the mussels with fresh baked bread - both the Meunière and Curry Cream mussels were delicious.  Also tried the Dates...More,NA,5
Late night dining done right,"We arrived at 9pm and sat at the bar. Eric greeted us and asked what would make us happy. He guided us to some excellent Bourbon selections. We then ordered appetizers and dinner. We expected boring, generic  bar food, but what was delivered was an...More",NA,4.5
Great Burgers,"My wife and I ate dinner there on  Saturday night. Arrived around 6:20 and had about an hour wait. We didn’t mind because they have a cool atmosphere. After we sat down we had to wait for a while after we ordered our food, however...More",NA,3.5
Late family lunch,The atmosphere is cozy. Great for family or a date. The food was exceptional. We had varying burgers including the seafood burger which was absolutely amazing!,"Hello! Thanks for taking the time to leave us a review. We value your feedback and are so glad to hear that you are a fan! We can't wait for you to dine with us again, hopefully soon:)",4.5
Post Christmas short family trip,Found the restaurant on TripAdvisor we decided to go after we toured the Louisville slugger factory which was great. Went into the restaurant sat down did not appear too busy. People were friendly. We ordered food and it took a very long time for burgers...More,"Hello, Thank you for taking the time to leave us a review. We appreciate your patience and apologize for the longer then usual wait time. We will use your feedback to make improvements going into the new year!",4
"Good food, moderate price ","Appetizer portion of mussel is plenty! (1/2) lb).  Enjoyed the Greek Mediterranean sauce.  Others had the mussels in white sauce and the burger sliders.   
Good food and bar.  Convenient in downtown, walked from hotel.More",Hello Alison! Thanks for leaving us a 5 star review. We are so glad to hear that you are a fan of our food! Given that you enjoy mussels I suggest giving out Curry Cream Mussels a shot next time you are in. They are...More,4
We tried the burgers and wings,"Six family members out for lunch on a Friday. One worked in downtown Louisville, so we wanted to dine somewhere close to his work place. Three of us had to feed meters to park. Hamburgers were a good size, but more enormous due to the...More","Hi Patricia, We are so glad you all decided to dine with us! We are happy to hear that you had a fantastic experience and we look forward to you dining with us again in the future!",5
Good food!,"We had a great meal at this place, the mussels were the best part so definitely try a few varieties. The reason for the four stars is because some of our burgers were not very good, in theory they sound good but at the end...More","Hello Elisa! We are glad to hear that you are a fan of our various mussel dishes. While we wish our burgers wow'd you we certainly understand everyone has different tastes! However, if you decide to be a bit more adventurous with our burgers on...More",4.5
"WOW, WOW and WOW","There were so many tastes enjoyed during our visit.  One of the bonuses of dining with a group of seven is that you get to share and try everyone's choices. 
CASEY took real good care of us.  I know it can't be easy answering all...More","Hello! Thank you so much for taking the time to share your experience with us, we are happy to hear we wow'd you! I will be sure to pass your review along to Casey as we love to hear when our employees hit the mark....More",4.5
Consistently impresses...,"I’ve been here numerous times for drinks and dinner. They serve carefully crafted cocktails, a variety of nice appetizers, and enjoyable entrees. It can be a bit crowded and slower service pre-event at the Yum Center or Arts Center, but it is a convenient location...More","Hello , Thank you so much for taking the time to leave us a review we truly value you as a loyal customer! We appreciate your patience as we work our hardest to accommodate all of our guests during our busier times! We hope to...More",4.5
A Great Dining Experience,"My wife and I dined at Mussel & Burger Bar Downtown on Wednesday, 11/20, after a long day of traveling from NY to KY.  Everything about our visit was exactly what we were hoping for.  First, tt was a quick walk from our hotel, Homewood...More","Hello! We are so glad that you chose to stop in and dine with us! Thank you for taking the time to share your experience with us, and we look forward to you dining with us again soon:)",5
"Solid burger, great service",Stopped in with a colleague for a bite to eat before our flight. Server was great. Specialty Burger and sweet potato fries were very good.,Hello! Thanks for choosing to dine with us at Mussel & Burger Bar! We truly appreciate your feedback and can't wait for you to dine with us again soon!,4.5
Burgers and mussels are INCREDIBLE,We met up with a cousin who lives local. He said we had to eat dinner here before our flight back to the east coast. Ordered Kentucky mules at the bar while we waited a quick 10 min to be seated. Highly recommend sharing mussels...More,Hello! Thanks for taking the time to leave us a review. We truly value your feedback and look forward to welcoming you back to dine with us very soon:),3.5
Best. Food. Ever. ,"Okay, first of all, our server Tatiana was ABSOLUTELY AMAZING.  She was super helpful and offered lots of first hand recommendations. We had old fashions to start and they were suburb. Listen- order the dates as an appetizer. YOU WILL NOT REGRET IT. If I...More",Hello! Thank you so much for taking the time to share your experience with us. We will be sure to pass along your positive words to Tatiana! We agree with your recommendations and can't wait for you to dine with us again soon:),4.5
Awesome burger,Probably the best burger...the local burger and pozole mussels I've ever had.  I didn't  even med mustard.,"We are so glad to hear that you are a fan! We love making it to the top of peoples ""Best Burger"" list! Thank you for sharing your experience with us, we hope to welcome you back soon!:)",4
Late-Night Dinner after a Long Drive,"We decided to eat at Mussel & Burger Bar because of the reviews on TripAdvisor and the fact that it was within easy walking distance from our hotel.
Casey was our server. She took care of us as if we were old friends. I'm not...More",Hello! Thanks for taking the time to leave us a review. We are so glad to hear that you are a fan and we can't wait to welcome you back soon:),4
Great affordable food in a great setting.,"My husband and I popped in for lunch before going to the Slugger museum and I'm glad we did. The short rib nachos were out of this world! And huge, despite being on the appetizer menu. I had it as my entree and couldn't finish...More","Hello, Thank you for taking the time to leave us a review. We truly appreciate your feedback and can't wait for you to dine with us again!",5
Good burger,"I stopped here because the restaurant I was going to was closed. Glad I did. The burger and fries were great. The atmosphere was what you'd expect. And the staff was friendly, if not attentive. Walking distance from all the museums around downtown.",Hello! We are glad to hear that you decided to stop in and give us a shot! Thanks for your feedback and we hope to welcome you back soon!,4.5
Amazing Place To Eat,"I was in town for a college visit and was looking for someplace within walking distance from our hotel. This place was recommended by our front desk clerk. Let me say, this was the best recommendation ever. We enjoyed the service and the food so...More",Hello! Thank you so much for taking the time to share your experience with us! We love to hear when we've hit the mark and we are thrilled to hear that you are a fan of MBB! We hope that you will choose to dine...More,4.5
Great Mussels,"I had the chorizo burger for my main meal and it was ok. I like chorizo but it was a little to much. The others in my group said their burgers were great though, I guess I just picked the wrong burger. That being said...More",Hello! Thanks for the love! We truly appreciate your feedback and can't wait to welcome you back soon:),4.5
"Stumbled into, not disappointed!","We visited this restaurant twice on our 4 day trip to Louisville. Fantastic burgers, very knowledgeable and friendly staff. Sweet potato fries were perfectly cooked and the burgers were delicious. Great bar and bourbon selection to choose from",Hello! We are so glad that you decided to dine with us during your trip:) We appreciate your feedback and hope that you will dine with us again soon.,5
Exceeded my expectations,"When you think of a restaurant that’s title starts out with “Burgers”, you might slight it a bit.  Then add “Mussels” and you’re like “what?”.   This place has a very cool bar vibe so don’t be deceived by its name.  We just finished a wonderful...More",Hello! Thank you so much for choosing to dine with us at Mussel & Burger Bar! We truly appreciate your feedback as we love to know when we've hit the mark! Your recommendation is appreciate and we hope that you will choose to dine with...More,4.5
Delicious food/great atmosphere,Had a delicious dinner here. Our server was delightful and very knowledgeable. Mussels and calamari were delicious! Churrasco steak was tender and portions were large. Highly recommend.,Hello! Thank you for your recommendation! We truly appreciate your feedback and can't wait for you to dine with us again soon:),3.5
Mussels? Yeah! Burgers? Oh Yeah!!,"My wife and I had dinner here on a night of our 12 year anniversary trip to Kentucky.  The service was excellent, the mussels have choices of sauces, and there are numerous burgers to choose from.  Everything we tasted was very flavorful, cooked perfectly and...More",Hello! Thank you for choosing to dine with us at Mussel & Burger Bar! We truly appreciate your feedback and appreciate your recommendation. We look forward to welcoming you back soon!,4.5
Best burger ever!!,We love burgers and are always on a quest for our favorite burger. We are from out of town and were staying nearby to go to a wedding that evening.  Read about the good food and had lunch here.  Got there around 2 and had...More,Hello! Thank you for taking the time to leave us a review! We are so glad to hear that you are a fan of MBB and can't wait for you to dine with us again soon:),4
"Nice vibe, food and drinks for a good price","We ate a lighter dinner here on 10/13.  We each had 2 Manhattans which were well made, the Korean BBQ Wings, and we split a Caesar salad (which was huge) and split the M&BB Grilled chicken sandwich.  The grilled chicken sandwich was really delicious.  It...More",Hello! Thank you for taking the time to leave us a review. We truly appreciate your feedback and can't wait for you to dine with us again soon:),4
Two is a charm with Mussel & Burger Bar Downtown,"At our recent trip to Louisville with friends, we ate at Mussel & Burger Bar and loved the food so much we went two days in a row!.  The first time we had lunch with one set of friends and we bragged on it so...More",Hello! Thanks for the love! We truly appreciate your feedback and are so glad to hear that you had a stellar experience and MBB! We can't wait for you to dine with us again to explore more of our menu!,5
Small Mussels and Long Wait,Our two couples were looking forward to our dinner. Had drinks at the bar on a Wednesday night and waited over 30 minutes for a table. No problem. My manhattan was good yet a tad short. Three of us ordered mussels and were surprised they...More,NA,4.5
"Great Bar, Burgers and Mussels","The name says it part-way--but moreso, the mussels were fresh and burgers, mussels and oysters all delicious. Great place to hang with my grown sons.",Hello! Thanks for the love! We hope you and your sons will be back to dine with us again soon:),4.5
Awesome Burger!,Please come to Indy!  Best burger I have had in a long time. I had the Argentinian and my partner had the CEO with Foie Gras; we loved both.,Hello! We are so glad to hear that you are a fan of our Burgers! We hope that you will dine with us again soon:),4.5
Interesting and worth the price of admission,"Not a name that resonates with my interests necessarily, although I like them both.  But together as a brand notion? Well slap me up side of my head.... what a great place.  My burger was over the top.  Perfectly prepared and the fries to die...More",NA,5
My Goto Restaurant in Louisville,"If possible, sit outside in their red brick and ivy courtyard and sip on a mint julep!  The appetizers are a wonderful meal in themselves.  Everything I've had there so far has been excellent over multiple visits.  Go with what sounds good to you, you...More",NA,4.5
Amazing truffle fries and short-rib nachos!,"This place totally lived up to our expectations...and then some.  In town for the Urban Bourbon Half Marathon, we discovered this place online.  Menu sounded very good and it didn’t disappoint.  The truffle fries were the best fries I’ve ever eaten.  Lots of flavorful oil,...More",Hello! Thank you for taking the time to write us such a fantastic review. The Curry Cream mussels are my personal favorite and I'm so glad to hear that you enjoyed them along with your other dishes. We truly appreciate your feedback and hope that...More,3.5
Great food great service. ,The burger was excellent. The server was good and the hostess was awesome. She remembered my name and would use it to ask how things were.,"Hello, Thanks for the love, we can't wait for you to dine with us again!",4.5
"Great food, expect a wait",We ate dinner here with our kids after coming into town for the night- we were staying across the street at 21c so my husband put our name in and we hung out in the hotel until the table was ready as there is nowhere...More,Hello! We are so glad that you and your children decided to dine at Mussel & Burger Bar. We appreciate you taking the time to leave us a review and hope that you will dine with us again soon.,4
Family Birthday Celebrations,"We received two separate recommendations for Mussel & Burger and we were not disappointed.
The atmosphere was energized. Fun, friendly, inviting.
Food was amazing. I had mussels and they were fresh and delicious. My family had burgers, including the seafood burger. We were so full....More","Hello! We are so glad that you chose to dine with us at Mussel & Burger Bar. We appreciate your kind words and are so glad to hear that you are a fan of our food, atmosphere, and service! We look forward to you dining...More",4
Never disappointed!,"You know when you think of a meal months or years after you've enjoyed it that the restaurant is a winner! Casual, friendly, reasonable prices and AMAZING food! We never kiss an opportunity to fine here if headed to Louisville!More",Hello! Thank you so much for taking the time to leave us a review and for choosing to dine with us at Mussel & Burger Bar:) We are so glad to hear that you are a fan of our food and we look forward to...More,5
Job Well Done,"After several years I finally made it to the restuarant.  I have been missing out as service, wait times, courtesy of staff & food quality were much better than average.  Will be back many times in the future.  All the way a Job Well Done!","Hello! Thank you so much for choosing to dine with us, we are so glad that you were able to make it in:) Don't miss out on our Oct. gift card giveaway!! check out our Instagram for details on how to enter!",4.5
Great Atmosphere,"We ate on the back patio which was a pretty cool environment. All of the beer is single serve, no draft. The food was amazing. The inside definitely had a reclaimed classy feel.  I had a burger, I did not have the muscles but they...More",Thank you for choosing to dine with us at Mussel & Burger Bar! We truly appreciate the love and hope that you will dine with us again soon:),4.5
Hello Yum!,"We were nervous coming here as they’re a top place for eats. The very nice hostess informed us that there’s be a 30 minute wait (for lunch!). But we decided to belly up to the bar because we’re impatient lol! So glad we did!

Met...More",Hi Andrea! We are so glad that you chose to dine with us at Mussel & Burger Bar:) We love hearing when our food hits the mark and we are so glad to hear that was the case during your visit. Can't wait for you...More,4.5
Do not miss this while in Louisville!,We had dinner here and are absolutely thrilled we didn't skip this spot. Everything was delicious and entirely worth every dollar! My husband had a drink which he enjoyed and we started with the mac and cheese appetizer which has fried cheese curds on top!...More,"Hello! WOW, Thank you so much for taking the time to leave us a review! We are certainly feeling the love and please know that we truly appreciate your feedback and can't wait for you to dine with us again soon!",5
A MUST STOP in Downtown Louisville!,"Amazing Food, Amazing Drinks, & Amazing Atmosphere/Staff! This was our favorite place while we were in Downtown Louisville! The B.B.B (Bacon Breakfast Burger) is absolutely delicious!",Hello! Thank you so much for choosing to dine with us! We are SO glad to hear that you consider Mussel & Burger Bar a Louisville must!! We appreciate your feedback and look forward to you dining with us again soon:),4.5
Great Burger,"For deluxe burgers of all kinds of taste, this is the place. We also enjoyed the loads of sweet potato fries. Great location to all the fun places downtown.","Hello! Thanks for taking the time to share your experience with us! We are glad to hear that you are a fan of our food, and we look forward to you dining with us again!:)",3.5
Birthday celebration,"Stopped in late to finish a day of celebrating. The bar is amazing, and the craft cocktails from the knowledgeable staff were great. Food was outstanding. Don’t miss the fries.",Hello! We are SO glad that you chose to celebrate your birthday with us at Mussel & Burger Bar! We truly appreciate your kind words and hope that you will join us again soon!,4.5
Old Fashioned Heaven!,I'm not an old-fashioned drinker but when in Rome! I have to tell you that this old-fashioned was amazing!!! The drink has layers of depth to it which are complex and delicious!! I had the mussels w/ Blue Cheese and Pancetta. The bread and sauce...More,"Hello! Awesome, so glad that you gave our old fashioned a shot and loved it!  We appreciate your feedback and hope that you will choose to dine with us again very soon!:)",4
Rehearsal Dinner,"We held the rehearsal dinner for our son’s wedding at Mussel & Burger Bar.  It was fantastic!  The food was awesome, the service was great and the private room was wonderful.   We all had a great time. Couldn’t have been better.",Hello! We are so happy you've chosen Mussel & Burger Bar to celebrate such a wonderful event! We truly appreciate you taking the time to share your review with us and hope that you will dine with us again soon!:),4
Phenomenal,"One of the best burgers I’ve had in a long time! If you know the difference between rare, medium rare, and medium (and you care about how your burger is cooked), this is the place to eat. Had the CEO burger with roasted tomatoes and...More","Hi Todd! Thank you so much for your feedback! We are so excited to hear that you've given us a ""Perfect 10!"" We pride ourselves on providing a unique and consistent dining experience! We hope that you will dine with us again very soon, be...More",5
"Mussel & Burger Bar Downtown, Louisville, KY","The burgers are great , big and juicy, the service was great. get there early or make a reservation, fills up fast. or set at the bar.",Hello! Thanks for the love Stephen! We truly appreiaceh your feedback and can't wait for you to dine with us again soon:),4.5
Great burger but...,"This restaurant was highly recommended to me by Hilton hotel.
While the burger was very good , the service was terrible. 
I asked to be moved before my food was served  because it was freezing cold sitting at the bar. The hostess did change my...More","Hello, Thank you for taking the time to share you experience with us. We sincerely apologize as that is certainly not the level of service that we typically provide. Your review will be shared with management to ensure that the issues is addressed and will...More",4.5
Dinner with my family,"The food are good , the ambiance is ok but the noise are so loud due to so crowded with drinking people and the open concept makes is harderto hear. It's not an intimate seat down grub. It's pricey but expected, overall it's ok.More","Hello! Thank you so much for choosing to dine with us at Mussel & Burger Bar. I will be sure to share your review with management, thought with an influx of people does come noise. I would like to suggest checking out our Patio downtown,...More",4.5
Amazing,"The food was divine and wonderful atmosphere. Fun atmosphere, close to the water front, lots of local shops to browse.",Thank you for taking time to leave us a review! We cannot wait to see you again!,5
Largest steak fries ever,"We had a 30 minute wait , but the food is worth it. I had a pleasant surprise on the beer menu finding 2 brews from Upland Brewing in Bloomington, IN. Our server strongly recommended getting one of the burgers since that's their specialty.
The...More",Thank you so much for taking a moment to leave us a comment We pride ourselves in bringing in the best quality product to give our guests a wonderful experience! We look forward to seeing you again!,4.5
Tourist Magnet,"Don't bother if you have any tastebuds left. 
You are in a foodie city with an exemplary array of local restaurants... ALL worth finding!

I had a great experience at Mussels Burger Bar. Yep, they have a vast menu of BOTH!
113 S 7th St,...More",Thank you so much for taking a moment to leave us a comment. We pride ourselves in bringing in the best quality product to give our guests a wonderful experience! We look forward to seeing you again!,3.5
Best Burger!,"It’s definitely a must if you are in pursuit of the best burger ever!

We happened upon this place and glad we decided to give it a try.  

The burger was cooked perfectly and served hot!

The fries are handcrafted and served hot and were...More",NA,4.5
Good cocktails and burgers!,Beet burger was yummy and we loved the sweet potato fries!  The cocktails were delicious and offered fun options!,"Thank you for your kind words, and for taking a moment to leave us a comment. We cannot wait to see you again!",4
Good burgers & dessert,"Burgers a little pricey, but big, cooked to order and good. I shared mine with my adult daughter. Fries came with it. They were good and plentiful. We were content with the amount of food we had. My husband had two sliders and was happy...More",NA,4
Great food!,We had the Mediterranean burger and the Chorizo burger - two of the best burgers we’ve ever had! The sweet potato fries are delicious as well. Definitely recommend!,NA,5
