headline,content,response,star
Mussels at Bar,It was Sunday and the place was packed. We went to the bar for a drink and two orders of mussels. My wife got them cooked with the white wine and garlic and I with the tomato sauce and sausage. They were cooked to perfection....More,"William,

I'm so pleased to hear that you and your wife had a great time at our bar.  We pride ourselves on making the atmosphere in our restaurant a welcoming place for everyone.  I will pass the word along to our Sunday bartenders that said...More",5
Great lunch!,Had the sliders and the mussels. Both good.  Truffle oil fries were disappointing and I am usually a big fan.  Good selection of cocktails and bourbon. Very good service.,"Hello! Thank you for taking the time to leave us a review. If you can, please DM us with how we could have improved our truffle oil fries. We certainly strive to provide consistent  exceptional food and service.",4.5
"Great find, by accident","We had just left the 21c museum in downtown Louisville and needed to feed a family of 11 - all with differing tastes. Instead of hopping on an app to find a good place to eat, just saw it across the street and went for...More","Nucleartax, 
Thank you for taking the time to review us!  It's great reading reviews like this where the customer stumbles upon us and thoroughly enjoyed their experience at Mussel Burger and Bar. The dates in a blanket is one of our most well-liked appetizers, I'm...More",4.5
A Nice Place to Escape the Heat,"We were visiting Louisville for just an afternoon, and we were planning on having a large group for dinner. I picked this location because the reviews said it had good food (it did) and that it was usually pretty easy to get a table (it...More","Hello, Alexandra! What a great review. I'm so happy we were able to live up to your expectations and accommodate your large group. It means a lot that you took the time to recommend us, and we hope to see you all again someday!",4.5
Excellent Burgers and Cool Atmosphere,"Loved our meal here.  They have basic burgers but more impressive are their creative unique burgers.  My whole family loved their choice. They also have excellent muscles, very unique choices and the one we picked was great.  Our server was very knowledgeable about the menu...More","Thank you, Andrew! I'm so glad to hear that you and your family enjoyed your meal, and I'm especially glad to hear you compliment the service. We work hard to train our staff to guide guests to the ultimate experience with us and we appreciate...More",5
Delicious!,I took my teens down to Louisville to meet up with a friend that was in from TX. We spent the weekend playing tourist and found this place. My boys were STARVING(because they are teen boys) and decided to give this place a try. The...More,"Thank you for this glowing review! We really appreciate you taking the time to review and recommend us, and we are so glad you and your boys were able to enjoy your experience with us.",4.5
Could have been great,"Visiting Lousiville, heard great things about Mussels & Burgers.  Loved the look, atmosphere of this place. The bartender kindly helped us decide on what was yummy to try.  Ordered one of their famous mussels dishes, it came out good and hot but the mussels tasted...More","M C,

I'm sorry to hear that you did not have a positive experience here at Mussel Burger and Bar.  We receive our mussels from Prince Edward Island off the Canadian coast, and 99% of the time they are wonderful.  However, everyone once in a...More",3.5
"Great place, wonderful food ",Excellent atmosphere and great food. Wait staff was exceptional. Anyone visiting Louisville should check this place out.,Thanks for taking the time to review us! We hope you are able to make it back one day.,4.5
Delicious!!!,Everything we ordered was absolutely delicious but the mussels were the BEST we’ve ever tasted.  We had the traditional style with wine & butter and a side of fries and could not stop eating them.  Our server was awesome (wish we could remember her name)....More,"Russ and Ange,

Thank you for taking the time to review us, we really appreciate that.  I'm so glad to hear that you enjoyed the mussels; I hope you can come back and try some of our other items on our menu.  Thanks again!",4
"Yummy mussels, great service!",We dined here for lunch after walking from the Galt House on a very hot day so it was great to be in the a/c and we were pleased to be promptly seated. Our server was great - I think her name was Casey -...More,Thank you for taking the time to review us.  I am so glad to hear you enjoyed the mussels and that service was great.  I'll be sure to let Casey know that you said so.  I hope that you and your husband are able to...More,4
Family visit,"Went here today Friday, June 1. Hostess was on the phone for ten minutes and didn’t even acknowledge that we were there. We left and walked by to another restaurant 5 minutes after we left and she was still on the phone. Our time is...More",I'm so sorry to hear about your experience. We train our staff to never have cell phones out and if they are on a call to the business phone we train them to ask to put the call on hold to speak to the guests...More,5
This place is incredibly!,"Above and beyond the BEST! OMG are you kidding,  where did this place come from? I can see why they were featured on the Food Network. The service, food and atmosphere were delightful!","Thank you so much, Arthur. It's always great to read comments like these. We strive to be one of the best dining experiences in Louisville, and we appreciate you taking the time to review and recommend us. Come back and see us again soon!",4.5
Good burger place,"While nothing stood out for me at this place, I would still recommend it if you are in the mood for a good burger or salad in downtown Louisville.  Reasonably priced, lots of tables, good variety of options on the menu.  No need to go...More","Hi, Jeffrey. Thank you for your review and recommendation. I'm sorry to hear that nothing here wowed you, hopefully next time you are here we can direct you towards a menu item that is sure to impress. Thank you for the feedback, and we hope...More",4.5
great food.,"got a order to go and surely was fantastic. burgers and fries were perfect, not greasy and super tasty. next time I return to Louisville this will be my go to spot.","Thank you, Ron! I'm glad to hear you enjoyed your carryout order. Come back and see us again soon!",4.5
Most awesome meal,"Stopped here on our way to Nashville. Looked up the reviews and it exceeded our expectations. The mussels were hearty, flavorful, sweet and savory with the chorizo making the sauce pop with flavor.
Was pretty surprised though when they said they had no spoons! What?’...More","Hi, Susan! 

Thank you for your review and recommendation. I appreciate getting such detailed feedback. It's so great to hear that you enjoyed your meal, the BBQ burger is a very popular choice. I'll be sure to look into the spoon situation, we absolutely have...More",5
"Nice building , good food and great service.","Stopped for a late lunch in a Tuesday afternoon. Nice building and crowd for an afternoon. Good variety on the menu. Sat at a table in the bar area. Katherine, a bartender ,  was our server. She was excellent! Had some nice mussels with pancetta...More",Thank you for taking the time to write a review for us.  I'm so glad you enjoyed your mussels and burger.  Kate is a wonderful part of our front of the house staff; I'll let her know you raved about her service.  I hope you...More,4.5
Sofrito Nearly Ruined It,"Fantastic venue.  Fantastic service.  Great food.  Whenever I can get mussels,  I do. We had the Moules Basquaise, Sweet & Spicy Calamari and the BBB, Bacon Breakfast Burger. 

If you don't know what sofrito is, Google it because my wife can't do tomatoes and sofrito...More","Hi Mr. Carson, 

Thank you for taking the time to leave such a detailed review. I've made notes for the chef and we will take all of your feedback into account. We try to make sure that our servers are very well trained on the...More",3.5
Fun FOOD,After my great day at the Ali Center....My friend Cindy took me here for a wonderful lunch. We both had the Sliders and they were very good.Very nice atmosphere. Good food.,Thank you for your review and recommendation. We are so glad to hear you enjoyed your experience in downtown Louisville! Come back and see us again soon.,4.5
Anniversary,"We had an awesome server, Dominique  & great appetizers & drinks on May 4, 2018!  MBB bourbon 🥃 brew - was delicious 😋!!!  Dominique was super friendly & her expertise on appetizer recommendation was superb!!   Loved the atmosphere/ambiance!!!More","Hi Sara!
Thank you for taking the time to review us.  I'm so glad you had a great anniversary. Dominique is a great part of our team.  I'll let her know you mentioned her awesome service.  Hope you are able to join us again and...More",4
Nice all aroiund,"Great service at the bar!  Good menu. Easy walk from the Louisville Slugger museum.
Good for the whole family.","Hi Sansa! Thank you for your feedback and for taking the time to review and recommend us. I'm glad to hear you enjoyed your experience, and I'll be sure to let the bar know you appreciated their service.",4
Eat here,"I was in Louisville for work and stopped in here for dinner by myself. The food was excellent. The menu offers something for everyone, even those of us that don't eat mussels. The burger I had was delicious and appeared to be hand packed. I'd...More",Thank you so much for the review and recommendation! It was great to read about how much you enjoyed your experience. We hope to see you again someday soon!,5
Great food in a cool environment,"We stopped in here for lunch based on favorable reviews here and we were definitely happy we did!

We got there a bit before the rush (11:30 on a Saturday) and were seated right away. The space inside is very cool, with a high vaulted...More","Thank you so much for the review and recommendation, I really enjoyed reading it! I passed along your comments about the fries to the chef, we will definitely work on that. We hope to see you in again soon!",4.5
Must Eat Here,"The calamari was out of this world. The Mediterranean Burger made my taste buds happier then they have been in a long time. The smoky pineapple sauce for dipping the sweet potato fries was amazing. If you are in Louisville and aren’t eating here, shame...More","Thanks, Andrew! The Mediterranean burger is a great combination of flavors, I'm glad to hear you enjoyed it! We appreciate the great review, and hope to see you again soon!",4.5
Something for everyone here,"Like the name says, this place serves two different types of fare-mussels and burgers. The burger sliders were tasty, and the entree seafood burger was full of tasty seafood. The mussels were served in a tasty broth and well prepared, though they were a little...More","Thanks for the feedback and taking the time to recommend us. I passed on your comment about the mussels being gritty to the chef, we will make sure we are cleaning them thoroughly. I'm glad that you enjoyed the food and service, we hope to...More",4.5
"Great food for a great price, broad menu","Food was delicious and fresh - served hot. Had the Moules Meunière, and the shallots and pepper were in the broth and so good. The grilled veggies were so good and the fries were also good. The service was great and didn't hurry anyone along....More","Hi Kate! I'm so glad you enjoyed the meuniere mussels, a classic and a favorite.  Thanks for taking the time to leave us a review. Come back and see us again soon!",5
One of the best meals we had in Louisville!,We ate at the downtown location during the Thunder over Louisville.  We went just as the fireworks were going to start so the crowd was minimal.  Zach our server was a great sport for our rowdy crowd!  The mussels and burgers did not disappoint.  Burgers...More,"Maribeth!

Thank you so much for taking the time to review us.  I'm glad you enjoyed the burgers and mussels, we hope to see you again soon.  I'll make sure to tell Zach that you enjoyed the service.  Thanks again Maribeth!",4.5
Fine Dinner!!!,We checked Tripadvisor for Louisville restaurants. This was listed as #1!!!! Rightly so!!! Fabulous food!!! I had the mussels and asparagus and green beans. My husband had a hamburger and fries. Both entrees were just delicious!!! Wish I could dine there tomorrow!!! Service was outstanding...More,Cathy! Thank you for taking the time to review us.  I am so happy to hear that you and your husband enjoyed your meal.  I hope you are able to come back and try more of our menu one day!,3.5
Good restaurant,We had a good meal at Mussel & Burger Bar. The service was good and the price for our entries was fairly reasonable. We would definitely go back when we visit the city again.,Thank you for taking the time to review and recommend us. We hope to see you again soon!,4.5
Great food!,Service was great and food was really good!! Was fairly close to our hotel! Would definitely visit again if in the area!,"Thank you, Crystal! I'm glad to hear that you enjoyed your experience. Thanks for taking the time to review and recommend us, we hope to see you again soon!",4
Good Mussels,"This downtown restaurant offers unusual pairing of mussels and gourmet burgers, along with a unique array of other items. The Greek-style mussel appetizers were served in a savory, flavorful broth. Very tasty! Unfortunately,  the Southern Bell burger was a disappointment--the pretzel bun overpowered the meat...More","Thanks, Vernon! We appreciate the feedback and will take this into consideration moving forward. I'm glad to hear you enjoyed the rest of your experience, and we hope to see you again soon!",4
Loved the seafood burger!,"Stoppe here for lunch, the seafood burgerwas wonderful,  though leave off the crab aoili if you don't like hot spice. Also the sweet potato fries were great, well cooked as were the regular fries.","Hi Connie! Thank you for taking the time to review and recommend us, I'm glad to hear you enjoyed your seafood burger. Come back and see us again soon!",5
Delicious,"This is a great spot! Though I didn't have the burger or the mussels, I did have an amazing iceberg wedge and creative hushpuppies. The bar staff is lovely. I stayed at the 21C Museum Hotel across the street and they were great at providing...More","Thank you for taking the time to leave a review and recommend us. I'm glad to hear we provided you with great takeout, we don't get much feedback on those items once they leave the store so we appreciate the information. Hope to see you...More",4.5
The hotel sent us here! Worth every penny.,We took the recommendation from our hotel.  The fish tacos were scrumptious and the burger my hubby had was huge and tasty. Our waitress was super attentive and helpful with menu suggestions. I wish I could remember her name. Eat here. The atmosphere is groovy...More,"Thank you, Melissa! We appreciate you taking the time to recommend us. I'm so glad to hear that you and your husband enjoyed your experience with us, and it's always great to get good feedback about the service, I'll pass that along. Come back to...More",4.5
"There's a reason ""Mussels"" is in the name","They were some of the most tender mussels I've ever had, perfectly cooked, as was the broth.  The mac and cheese is also excellent.  Even though stuffed, we got the the tiramisu cheesecake which was totally worth it.  Service is also fast and friendly.More","Thank you for taking the time to review and recommend us! It's great to hear some feedback about the mussels, we always strive to make sure they are of the highest quality. And good call on the tiramisu cheesecake, it is a staff favorite. Come...More",4.5
Great burger!,"Stopped in here on a recommendation, wasn’t disappointed. Hardest part was choosing which burger! I got the BBQ Bacon. It’s a tall tasty creation. The fries were great. I wish I’d have gotten the mussels appetizer with it but I don’t know that I would’ve...More","Thank you for taking the time to review and recommend us! I'm glad to hear you enjoyed your burger, some back and see us to try the mussels some day soon!",5
Downtown Burger Pub,"Upscale Pub located near the Louisville slugger factory and museum.  Neat old historic building with rich dark woods and tall ceilings.    Very busy when we arrived at 2:30pm, but got seated fairly quick.  I had the crabcake sandwich and my wife had a beef burger,...More","Hi Terry, 
It's awesome to read about how much you enjoyed your meal with us. I'm glad to hear that we still gave you a great experience even during a busy rush. We hope to see you again soon!",4.5
"Good, but...","My wife very much enjoyed her mussels.  Had it not been for the very good and plentiful sweet potato fries, my hamburger was so small, I would have left hungry.  As advertised, the meat was excellent and perfectly (medium rare) prepared.  I had requested that...More","Hi Mark,

Thank you so much for coming and for taking the time to review and recommend us! Sorry about the disappointing size of the burger you had. Normally we serve 8-ounce burger patties. For lunches Monday through Friday the burgers and prices are smaller...More",3.5
Yummy!! So hood,We stopped in and split Argentina burger and the curry mussels they were so good! We loved are server she had great recommendations and told us to keep the sauce from the mussels to dip the fries!,"Thanks, Kris! I'm glad to hear you enjoyed your experience with us. Thanks for taking the time to review and recommend us, we hope to see you again soon!",4.5
Yummy food!,"We stopped here on our way to Nashville.  Great pick!  The food is great, we had the bacon wrapped dates that were amazing and the sliders.  The restaurant is decorated nicely and in a great area for tourists!",Thanks Stacy! We're glad you came and enjoyed everything! Thanks for coming and for making the recommendations! Hope we see you again soon!,4
Great PEI mussels,"We had a variety of dishes, there were 3 of us. Mussels, salad and a couple of burgers.  The burgers were thick, mussels were most excellent. Not cheap, so if you are on a budget, this will stretch it.","Thanks, Rick! It's great to hear that you enjoyed all the different dishes you were able to try. We hope to see you again soon!",4
"Seems like an odd combination, but it's not","The curry mussels are stupendous, the burgers are good too. The server was very helpful. Kind of dark, but it works.","We're so glad to hear you enjoyed your experience with us. Thank you for taking the time to review and recommend us, we hope to see you again soon!",5
Dinner on a vacation,"This restaurant was recommended by our Bourbon Trail tour guide, so we went after our first night on the distillery tour.  The name sounded odd, and the menu does have both a burgers section and a mussels section.  I had a cheeseburger that was perfect...More","Thanks Geoff! I'm so glad to hear that you enjoyed your experience with us. The bartenders really take pride in crafting seasonal old fashioneds for our cocktail menu, I'll be sure to let them know you loved it! Thanks for taking the time to review...More",4.5
We got there between rushes,Took the family after a visit to the Louisville Slugger Museum.  The Hamburgers were great.  Nice Restaurant and friendly staff,"Thanks, Jim. It sounds like you picked the perfect time to dine with us. I'm glad to hear you enjoyed both the food and the staff. We hope to see you again soon! Thank you for taking the time to leave a review!",4.5
"Downtown, not to be missed!","The ambiance is terrific which matches the food and service. One of our favorite downtown spots. The mussels are prepared in a variety of ways so you can select your preference. The burgers are scrumptious. The prices are excellent, especially considering the quality of the...More","Wow, Mike! Thank you for such a great review and recommendation. It's awesome to read about how you enjoyed all aspects of our location, and I'm glad to hear you enjoyed your experience. We really try to stand out among the great restaurants downtown, and...More",4.5
Take out,Stayed across the street at 21c Museum hotel and didn’t want to wait an hour for a table so we got 2 burgers to go. We weren’t disappointed!! Real homemade burgers and the fries were outstanding. Even my teenage girls enjoyed it. Highly recommend!,Thank you so much for taking the time to recommend us! We do a lot of carryout business so it's nice to get some feedback about that experience. I'm glad you and your girls enjoyed the food. We hope to see you again some day!,5
Delicious with wonderful service,"Before a performance at the Kentucky Center for Performing Arts, we decided to grab a bite at the Mussel and Burger Bar. The food was delicious—we of course got mussels and burgers—and our server, Terry, was wonderful. It was a very relaxing atmosphere with good...More","Thank you so much for coming and for taking the time to review and recommend us! It's great to hear about how much you enjoyed everything. I'll be sure to tell Terry about how much you appreciated his service, I know he'll think that's awesome....More",4.5
Surprised by the burger,"This is a favorite of alot ofmy friends but I have been twice and to be honest, I thought the burger was just ok and actually too greasy.More","Hi Debbie, 
I'm sorry to hear that you didn't enjoy your burger. We always strive to make sure the guest has a great experience, both with the service and ambiance but also with a quality meal and delicious food. Were you able to address your...More",3.5
Worth the wait!,"This place is amazing! Very popular and crowded but worth it. The menu was incredible, service great. The food is amazing. I will return!","Thank you for the review, it's awesome to read about how much you enjoyed your experience with us. I'm happy to hear that you not only enjoyed the food, but the service as well. We hope to see you again soon!",4.5
Burgers and beer,"Good place, food and service. Having looking for good burgers recently found the place where I will return.","Thank you so much for taking the time to review and recommend us! I'm glad to hear you enjoyed your experience, and we hope to see you again soon!",4
Great service and good food. ,"Went here for lunch to start the celebrations for a friend’s birthday. Our server was freat and everyone was pleased with their food. My wife and I had the charcuterie plate and some mussels. Also, the cocktails were very good.","Thanks for taking the time to write a review and recommend us! I'm glad you enjoyed your experience, and we hope to see you again soon!",4
Unique place,The food was good and the service was excellent.  Beer selection ok because of no draft. We will eat here again in the future.,Thanks Greg! We're glad you came and enjoyed everything. Hope we see you again soon!,5
Excellent food,fantastic crab sliders. Great service. Unbelievable dessert of carrot cake with homemade ice cream. Words can’t describe the layers of flavors and the sugar crunchies.More,"Thanks you so much for coming! We're glad you came and enjoyed everything. I love the Carrot Cake too, and the Spiced Pineapple ice cream that comes with it my favorite flavor. Thanks for taking the time to give us a review and recommendation. Hope...More",4.5
Awesome Burger and Atmosphere,One of the best burgers anywhere piled high with an assortment of toppings. Unique menu combination highlights succulent burgers and juicy mussels. Highly recommend!,"Thank you so much Sam! That's awesome! We're glad you came and appreciated everything so much! Thanks for taking the time to give us a recommendation!

Thanks,
Nathan",4.5
"Great food, excellent service","Very impressed with my visit.  The cheese plate and the seafood slider appetizers were both excellent.  I had the southern belle burger with a  fried green tomato on top, very good.  Several friends had the mussels and said they were outstanding.  My daughter’s burger was...More","Hi Bobbi! Thank you for taking the time to leave a review and recommend us. I'm glad to hear you enjoyed your experience with us, and I'm especially happy to hear that we were able to resolve that issue for your daughter in a timely...More",4.5
Great food,The burgers are great! I had the Southern with sweet potato fries! The dips for the fries though are absolutely fabulous with the sweet fries! Omg!!! Daughter had the mussels and they were very fresh and yummy! We highly recommend.More,"Thank you so much for coming and for taking the time to write a recommendation for us! We're glad you and your daughter enjoyed everything so much. We truly appreciate your positive feedback, and I'll be sure to show your review to the staff!

Thanks,...More",5
Delicious lunch with great service,"This charming restaurant caught my eye down a side street after I departed the Frazier History Museum along Museum Row.  Bustling at lunch, I was promptly seated and greeted by a server.  Traveling solo, I treated myself to a nice lunch of a chèvre fig...More","Thank you for taking the time to review and recommend us. I'm so glad to hear that you enjoyed your experience, and I hope that we can see you again some day!",4.5
"Great atmosphere, great food!","My husband and I dined here for lunch on a Saturday before seeing a show. I’ve planned events here several times before, but never personally dined here. The cocktails are good and food options were great. 

My husband had the all American burger and said...More","Hi, kimkaydee! I'm so glad to hear that you enjoyed your experience with us Saturday. Thanks for taking the time to review and recommend us. We hope to see you again soon!",3.5
